2340960	the attitude towards in Qatar and
2345600	yourself in person if I have not seen
2354490	you it is because of decisions which we
2359140	have carefully discussed amongst
2360730	ourselves and of which I am part I
2367200	however would like her to repeat what
2372550	you know I have said on numerous
2376660	occasions I would like the a and C and
2384160	in Qatar to sit down and resolve our
2388780	problems and end the violence that is
2391990	going on today in the town but you know
2396520	as well as I do that the question is no
2400630	longer simple the government has taken
2405760	advantage of the differences between my
2409320	organization and your organization they
2413470	are using those differences for the
2416740	purpose of trying to eliminate the ANC
2420670	and what they consider to be members of
2427240	that organization who are a threat to
2430390	white supremacy
2432100	that now is our problem it is no longer
2435910	just a question of me meeting you I have
2439990	asked him mr. de Klerk this simple
2442480	question I have said to him you have a
2448120	strong efficient and well-equipped army
2453700	and police force can you tell me why the
2460090	government has failed to suppress
2464070	violence in which almost 4,000 lexer
2467740	continue mr. de Klerk has never been
2475540	able to give a satisfactory answer to my
2478480	question I have told you I've given him
2482080	the answer I have said to him you have
2486700	not suppressed this violence
2488560	deliberately because you believe that by
2494380	using these differences between these
2496480	two organizations you can crush your
2500350	enemy number one the a and C that is
2504820	your difficulty and I must repeat to you
2507480	that is the main problem facing the
2510580	people of South Africa it is the
2512890	involvement of the government and its
2515710	police in the violence that is taking
2518530	place did not talk we have mr. Mandela I
2523120	believe on microphone B over there a
2525850	former representative of the South
2527620	African government he was until very
2529300	recently the Consul General here in New
2531130	York would you like to come to the
2532210	microphone and pose your question that
2533590	is sir mr. Koppel mr. Mandela as one who
2537040	for a period of years has advocated your
2538930	unconditional release I want to say at
2541180	the outset I'm delighted to see you here
2543010	in New York
2543640	welcome secondly I also commend you for
2547840	your loyalty to your friends
2549370	controversial though that may be but in
2552670	framing my question in dealing with
2554350	ANATEL in particular I as a white South
2558010	African and most concerned about the
2561490	bloodletting the carnage that is going
2563680	on
2564650	and whilst I take the point that you've
2567740	made that the police possibly and
2570080	probably could do more I do believe that
2572870	the challenge or the ball is in your
2574580	court mr. Mandela because one cannot we
2578330	as South Africans cannot afford to have
2580880	South Africans killing South Africans
2583220	we've got to have peace harmony a strong
2586010	economy we've got to hold out our hands
2588230	to each other so we can build a new
2590150	South Africa with a minimum of
2592850	bitterness I believe sir that you are
2595820	the Statesman who can do it I would like
2598040	to do you to do it and I'd like you to
2600050	issue a call I'd like you to extend the
2602360	hand to chief gotcha brutal izzy
2604420	irrespective of political differences
2606640	irrespective of dirty linen irrespective
2609500	of what has gone before I believe you
2611720	owe it to each other and the country to
2613910	see that we have a stable secure
2615890	platform on which to go forward together
2618260	white black and brown I hope you agree I
2623470	do not consider your remarks as a
2626690	lecture to me
2634250	because because you would know that it
2640049	is the agency had not the government
2644839	that has compelled the government to sit
2648660	down and talk this with us
